{
  "metadata": {
    "source_file": "beatsync-core/fixtures/midi/midi_basic_100.mid",
    "duration_sec": 9.6,
    "analysis_version": "0.1"
  },
  "tempo": {
    "bpm": 100.0,
    "confidence": 1.0
  },
  "key": {
    "name": "unknown",
    "confidence": 0.0
  },
  "rhythm": {
    "beats": [
      0.0,
      0.6,
      1.2,
      1.7999999999999998,
      2.4,
      3.0,
      3.5999999999999996,
      4.2,
      4.8,
      5.3999999999999995,
      6.0,
      6.6,
      7.199999999999999,
      7.8,
      8.4,
      9.0
    ],
    "bars": [
      0.0,
      2.4,
      4.8,
      7.199999999999999
    ]
  },
  "structure": [],
  "energy": {
    "curve": [
      0.0,
      0.0,
      0.0,
      0.0,
      1.0,
      0.0,
      0.0,
      0.0,
      0.0
    ],
    "peaks": [
      4
    ]
  }
}