{
  "metadata": {
    "source_file": "beatsync-core/fixtures/audio/click_120.wav",
    "duration_sec": 16.005,
    "analysis_version": "0.1"
  },
  "tempo": {
    "bpm": 60.09,
    "confidence": 0.9
  },
  "key": {
    "name": "A# minor",
    "confidence": 0.5797735236511272
  },
  "rhythm": {
    "beats": [
      0.0,
      0.9985022466300548,
      1.9970044932601096,
      2.9955067398901645,
      3.9940089865202193,
      4.992511233150275,
      5.991013479780329,
      6.989515726410383,
      7.988017973040439,
      8.986520219670494,
      9.98502246630055,
      10.983524712930603,
      11.982026959560658,
      12.980529206190713,
      13.979031452820767,
      14.977533699450822,
      15.976035946080877
    ],
    "bars": [
      0.0,
      3.9940089865202193,
      7.988017973040439,
      11.982026959560658,
      15.976035946080877
    ]
  },
  "structure": [
    {
      "label": "section_1",
      "start": 0.0,
      "end": 9.032562358276644,
      "confidence": 0.024154214188456535
    },
    {
      "label": "section_2",
      "start": 9.032562358276644,
      "end": 14.02485260770975,
      "confidence": 0.027309181168675423
    },
    {
      "label": "section_3",
      "start": 14.02485260770975,
      "end": 16.005215419501134,
      "confidence": 0.027470503002405167
    }
  ],
  "energy": {
    "curve": [
      1.0,
      0.17381443083286285,
      3.904312428915091e-09,
      0.0,
      0.0,
      0.0,
      0.0,
      0.0,
      0.0,
      0.0,
      0.0,
      0.0,
      0.0,
      0.0,
      0.0,
      0.0,
      0.0,
      0.0,
      0.0,
      9.821123114761576e-08,
      0.9783241748809814,
      0.27044677734375,
      1.747192834855582e-09,
      0.0,
      0.0,
      0.0,
      0.0,
      0.0,
      0.0,
      0.0,
      0.0,
      0.0,
      0.0,
      0.0,
      0.0,
      0.0,
      0.0,
      0.0,
      0.0,
      5.112615042435209e-08,
      0.9591246843338013,
      0.33217403292655945,
      1.4029755220690276e-05,
      0.0,
      0.0,
      0.0,
      0.0,
      0.0,
      0.0,
      0.0,
      0.0,
      0.0,
      0.0,
      0.0,
      0.0,
      0.0,
      0.0,
      0.0,
      0.0,
      0.0006817894172854722,
      0.9980291724205017,
      0.18492409586906433,
      1.9084961042081794e-11,
      0.0,
      0.0,
      0.0,
      0.0,
      0.0,
      0.0,
      0.0,
      0.0,
      0.0,
      0.0,
      0.0,
      0.0,
      0.0,
      0.0,
      0.0,
      0.0,
      7.831601323005088e-08,
      0.9748191237449646,
      0.28282031416893005,
      1.1376396713558279e-08,
      0.0,
      0.0,
      0.0,
      0.0,
      0.0,
      0.0,
      0.0,
      0.0,
      0.0,
      0.0,
      0.0,
      0.0,
      0.0,
      0.0,
      0.0,
      0.0,
      1.0088962554277714e-08,
      0.9727727770805359,
      0.28978070616722107,
      8.483901581257669e-09,
      0.0,
      0.0,
      0.0,
      0.0,
      0.0,
      0.0,
      0.0,
      0.0,
      0.0,
      0.0,
      0.0,
      0.0,
      0.0,
      0.0,
      0.0,
      0.0,
      9.195701750286389e-06,
      0.9959368109703064,
      0.1958816796541214,
      4.246383689121558e-09,
      0.0,
      0.0,
      0.0,
      0.0,
      0.0,
      0.0,
      0.0,
      0.0,
      0.0,
      0.0,
      0.0,
      0.0,
      0.0,
      0.0,
      0.0,
      0.0,
      0.0,
      0.9523944854736328,
      0.35100340843200684,
      0.0010899599874392152,
      0.0,
      0.0,
      0.0,
      0.0,
      0.0,
      0.0,
      0.0,
      0.0,
      0.0,
      0.0,
      0.0,
      0.0,
      0.0,
      0.0,
      0.0,
      0.0,
      3.213432364645996e-07,
      0.9945698380470276,
      0.20270808041095734,
      0.0,
      0.0,
      0.0,
      0.0,
      0.0,
      0.0,
      0.0,
      0.0,
      0.0,
      0.0,
      0.0,
      0.0,
      0.0,
      0.0,
      0.0,
      0.0,
      0.0,
      0.0,
      0.9675296545028687,
      0.3068324327468872,
      1.173803454435074e-07,
      0.0,
      0.0,
      0.0,
      0.0,
      0.0,
      0.0,
      0.0,
      0.0,
      0.0,
      0.0,
      0.0,
      0.0,
      0.0,
      0.0,
      0.0,
      0.0,
      3.5626072758532246e-08,
      0.946808397769928,
      0.3657912611961365,
      0.0031949253752827644,
      0.0,
      0.0,
      0.0,
      0.0,
      0.0,
      0.0,
      0.0,
      0.0,
      0.0,
      0.0,
      0.0,
      0.0,
      0.0,
      0.0,
      0.0,
      0.0,
      5.82355816902691e-08,
      0.992219865322113,
      0.21391460299491882,
      8.207043933339264e-09,
      0.0,
      0.0,
      0.0,
      0.0,
      0.0,
      0.0,
      0.0,
      0.0,
      0.0,
      0.0,
      0.0,
      0.0,
      0.0,
      0.0,
      0.0,
      0.0,
      4.424101263111879e-08,
      0.9619168639183044,
      0.3239996135234833,
      2.8878014290967258e-06,
      0.0,
      0.0,
      0.0,
      0.0,
      0.0,
      0.0,
      0.0,
      0.0,
      0.0,
      0.0,
      0.0,
      0.0,
      0.0,
      0.0,
      0.0,
      0.0,
      6.789418449670848e-08,
      0.9603561758995056,
      0.32859644293785095,
      1.1117323083453812e-05,
      0.0,
      0.0,
      0.0,
      0.0,
      0.0,
      0.0,
      0.0,
      0.0,
      0.0,
      0.0,
      0.0,
      0.0,
      0.0,
      0.0,
      0.0,
      0.0,
      1.0228184521565709e-07,
      0.9904382824897766,
      0.22201749682426453,
      3.19035131646217e-09,
      0.0,
      0.0,
      0.0,
      0.0,
      0.0,
      0.0,
      0.0,
      0.0,
      0.0,
      0.0,
      0.0,
      0.0,
      0.0,
      0.0,
      0.0,
      0.0,
      6.807688635035447e-08,
      0.9352743029594421,
      0.39423590898513794,
      0.009981004521250725,
      0.0,
      0.0,
      0.0,
      0.0,
      0.0,
      0.0,
      0.0,
      0.0,
      0.0,
      0.0,
      0.0,
      0.0,
      0.0,
      0.0,
      0.0,
      0.0,
      0.0
    ],
    "peaks": [
      0.999546485260771,
      1.999092970521542,
      2.998639455782313,
      3.998185941043084,
      4.9977324263038545,
      5.997278911564626,
      6.996825396825397,
      7.996371882086168,
      8.995918367346938,
      9.995464852607709,
      10.995011337868482,
      11.994557823129252,
      12.994104308390023,
      13.993650793650794,
      14.993197278911564
    ]
  }
}
